{
    "id":  "hwbtwtdwh_90min",
    "training_name":  "HWBTWTDWH 90min",
    "description":  "Converted from HWBTWTDWH__1_ 90min",
    "duration": 5400,
    "units":  {
                  "time":  "seconds",
                  "ftp_ratio":  "number"
              },
    "phases":  [
                   {
                       "start":  0,
                       "ftp_ratio":  0.6,
                       "notes":  ""
                   },
                   {
                       "start":  600,
                       "ftp_ratio":  0.95,
                       "notes":  ""
                   },
                   {
                       "start":  630,
                       "ftp_ratio":  0.5,
                       "notes":  ""
                   },
                   {
                       "start":  660,
                       "ftp_ratio":  1.05,
                       "notes":  ""
                   },
                   {
                       "start":  690,
                       "ftp_ratio":  0.5,
                       "notes":  ""
                   },
                   {
                       "start":  720,
                       "ftp_ratio":  1.15,
                       "notes":  ""
                   },
                   {
                       "start":  750,
                       "ftp_ratio":  0.5,
                       "notes":  ""
                   },
                   {
                       "start":  780,
                       "ftp_ratio":  0.5,
                       "notes":  ""
                   },
                   {
                       "start":  900,
                       "ftp_ratio":  0.88,
                       "notes":  ""
                   },
                   {
                       "start":  1020,
                       "ftp_ratio":  0.93,
                       "notes":  ""
                   },
                   {
                       "start":  1080,
                       "ftp_ratio":  0.88,
                       "notes":  ""
                   },
                   {
                       "start":  1200,
                       "ftp_ratio":  0.93,
                       "notes":  ""
                   },
                   {
                       "start":  1260,
                       "ftp_ratio":  0.88,
                       "notes":  ""
                   },
                   {
                       "start":  1380,
                       "ftp_ratio":  0.93,
                       "notes":  ""
                   },
                   {
                       "start":  1440,
                       "ftp_ratio":  0.88,
                       "notes":  ""
                   },
                   {
                       "start":  1560,
                       "ftp_ratio":  0.93,
                       "notes":  ""
                   },
                   {
                       "start":  1620,
                       "ftp_ratio":  0.88,
                       "notes":  ""
                   },
                   {
                       "start":  1740,
                       "ftp_ratio":  0.93,
                       "notes":  ""
                   },
                   {
                       "start":  1800,
                       "ftp_ratio":  0.5,
                       "notes":  ""
                   },
                   {
                       "start":  1980,
                       "ftp_ratio":  0.75,
                       "notes":  ""
                   },
                   {
                       "start":  2280,
                       "ftp_ratio":  0.83,
                       "notes":  ""
                   },
                   {
                       "start":  2580,
                       "ftp_ratio":  0.91,
                       "notes":  ""
                   },
                   {
                       "start":  2880,
                       "ftp_ratio":  0.5,
                       "notes":  ""
                   },
                   {
                       "start":  3060,
                       "ftp_ratio":  0.91,
                       "notes":  ""
                   },
                   {
                       "start":  3360,
                       "ftp_ratio":  0.83,
                       "notes":  ""
                   },
                   {
                       "start":  3660,
                       "ftp_ratio":  0.75,
                       "notes":  ""
                   },
                   {
                       "start":  3780,
                       "ftp_ratio":  0.75,
                       "notes":  ""
                   },
                   {
                       "start":  3810,
                       "ftp_ratio":  0.75,
                       "notes":  ""
                   },
                   {
                       "start":  3930,
                       "ftp_ratio":  0.75,
                       "notes":  ""
                   },
                   {
                       "start":  3960,
                       "ftp_ratio":  0.5,
                       "notes":  ""
                   },
                   {
                       "start":  4140,
                       "ftp_ratio":  1.1,
                       "notes":  ""
                   },
                   {
                       "start":  4170,
                       "ftp_ratio":  0.925,
                       "notes":  ""
                   },
                   {
                       "start":  4200,
                       "ftp_ratio":  0.75,
                       "notes":  ""
                   },
                   {
                       "start":  4500,
                       "ftp_ratio":  0.925,
                       "notes":  ""
                   },
                   {
                       "start":  4530,
                       "ftp_ratio":  1.1,
                       "notes":  ""
                   },
                   {
                       "start":  4560,
                       "ftp_ratio":  0.5,
                       "notes":  ""
                   },
                   {
                       "start":  4620,
                       "ftp_ratio":  1.1,
                       "notes":  ""
                   },
                   {
                       "start":  4650,
                       "ftp_ratio":  0.925,
                       "notes":  ""
                   },
                   {
                       "start":  4680,
                       "ftp_ratio":  0.75,
                       "notes":  ""
                   },
                   {
                       "start":  4980,
                       "ftp_ratio":  0.925,
                       "notes":  ""
                   },
                   {
                       "start":  5010,
                       "ftp_ratio":  1.1,
                       "notes":  ""
                   },
                   {
                       "start":  5040,
                       "ftp_ratio":  0.4,
                       "notes":  ""
                   },
                   {
                       "start":  5400,
                       "ftp_ratio":  0.4,
                       "notes":  ""
                   }
               ],
    "creation_date":  "2026-06-25T00:00:00+02:00",
    "source":  "Converted from HWBTWTDWH__1_.zwo"
}
