{
    "id":  "melange_90min",
    "training_name":  "Melange 90min",
    "description":  "Converted from Melange__1_ 90min",
    "duration": 5400,
    "units":  {
                  "time":  "seconds",
                  "ftp_ratio":  "number"
              },
    "phases":  [
                   {
                       "start":  0,
                       "ftp_ratio":  0.4,
                       "notes":  ""
                   },
                   {
                       "start":  300,
                       "ftp_ratio":  0.55,
                       "notes":  ""
                   },
                   {
                       "start":  600,
                       "ftp_ratio":  0.65,
                       "notes":  ""
                   },
                   {
                       "start":  900,
                       "ftp_ratio":  0.9,
                       "notes":  ""
                   },
                   {
                       "start":  930,
                       "ftp_ratio":  0.55,
                       "notes":  ""
                   },
                   {
                       "start":  990,
                       "ftp_ratio":  1,
                       "notes":  ""
                   },
                   {
                       "start":  1020,
                       "ftp_ratio":  0.55,
                       "notes":  ""
                   },
                   {
                       "start":  1080,
                       "ftp_ratio":  1.1,
                       "notes":  ""
                   },
                   {
                       "start":  1110,
                       "ftp_ratio":  0.55,
                       "notes":  ""
                   },
                   {
                       "start":  1170,
                       "ftp_ratio":  0.55,
                       "notes":  ""
                   },
                   {
                       "start":  1320,
                       "ftp_ratio":  0.85,
                       "notes":  ""
                   },
                   {
                       "start":  1920,
                       "ftp_ratio":  0.65,
                       "notes":  ""
                   },
                   {
                       "start":  2520,
                       "ftp_ratio":  1,
                       "notes":  ""
                   },
                   {
                       "start":  2640,
                       "ftp_ratio":  0.55,
                       "notes":  ""
                   },
                   {
                       "start":  2700,
                       "ftp_ratio":  1,
                       "notes":  ""
                   },
                   {
                       "start":  2820,
                       "ftp_ratio":  0.55,
                       "notes":  ""
                   },
                   {
                       "start":  2880,
                       "ftp_ratio":  1,
                       "notes":  ""
                   },
                   {
                       "start":  3000,
                       "ftp_ratio":  0.55,
                       "notes":  ""
                   },
                   {
                       "start":  3060,
                       "ftp_ratio":  1,
                       "notes":  ""
                   },
                   {
                       "start":  3180,
                       "ftp_ratio":  0.55,
                       "notes":  ""
                   },
                   {
                       "start":  3240,
                       "ftp_ratio":  1,
                       "notes":  ""
                   },
                   {
                       "start":  3360,
                       "ftp_ratio":  0.55,
                       "notes":  ""
                   },
                   {
                       "start":  3420,
                       "ftp_ratio":  1,
                       "notes":  ""
                   },
                   {
                       "start":  3540,
                       "ftp_ratio":  0.55,
                       "notes":  ""
                   },
                   {
                       "start":  3600,
                       "ftp_ratio":  0.65,
                       "notes":  ""
                   },
                   {
                       "start":  4200,
                       "ftp_ratio":  1.3,
                       "notes":  ""
                   },
                   {
                       "start":  4220,
                       "ftp_ratio":  0.55,
                       "notes":  ""
                   },
                   {
                       "start":  4260,
                       "ftp_ratio":  1.3,
                       "notes":  ""
                   },
                   {
                       "start":  4280,
                       "ftp_ratio":  0.55,
                       "notes":  ""
                   },
                   {
                       "start":  4320,
                       "ftp_ratio":  1.3,
                       "notes":  ""
                   },
                   {
                       "start":  4340,
                       "ftp_ratio":  0.55,
                       "notes":  ""
                   },
                   {
                       "start":  4380,
                       "ftp_ratio":  1.3,
                       "notes":  ""
                   },
                   {
                       "start":  4400,
                       "ftp_ratio":  0.55,
                       "notes":  ""
                   },
                   {
                       "start":  4440,
                       "ftp_ratio":  1.3,
                       "notes":  ""
                   },
                   {
                       "start":  4460,
                       "ftp_ratio":  0.55,
                       "notes":  ""
                   },
                   {
                       "start":  4500,
                       "ftp_ratio":  1.3,
                       "notes":  ""
                   },
                   {
                       "start":  4520,
                       "ftp_ratio":  0.55,
                       "notes":  ""
                   },
                   {
                       "start":  4560,
                       "ftp_ratio":  1.3,
                       "notes":  ""
                   },
                   {
                       "start":  4580,
                       "ftp_ratio":  0.55,
                       "notes":  ""
                   },
                   {
                       "start":  4620,
                       "ftp_ratio":  1.3,
                       "notes":  ""
                   },
                   {
                       "start":  4640,
                       "ftp_ratio":  0.55,
                       "notes":  ""
                   },
                   {
                       "start":  4680,
                       "ftp_ratio":  0.65,
                       "notes":  ""
                   },
                   {
                       "start":  5280,
                       "ftp_ratio":  0.375,
                       "notes":  ""
                   },
                   {
                       "start":  5400,
                       "ftp_ratio":  0.375,
                       "notes":  ""
                   }
               ],
    "creation_date":  "2026-06-25T00:00:00+02:00",
    "source":  "Converted from Melange__1_.zwo"
}
