{
    "id":  "sneaky_60min",
    "training_name":  "Sneaky 60min",
    "description":  "Converted from Sneaky__1_ 60min",
    "duration": 3600,
    "units":  {
                  "time":  "seconds",
                  "ftp_ratio":  "number"
              },
    "phases":  [
                   {
                       "start":  0,
                       "ftp_ratio":  0.5,
                       "notes":  ""
                   },
                   {
                       "start":  300,
                       "ftp_ratio":  0.6,
                       "notes":  ""
                   },
                   {
                       "start":  600,
                       "ftp_ratio":  0.8,
                       "notes":  ""
                   },
                   {
                       "start":  780,
                       "ftp_ratio":  0.95,
                       "notes":  ""
                   },
                   {
                       "start":  840,
                       "ftp_ratio":  0.55,
                       "notes":  ""
                   },
                   {
                       "start":  900,
                       "ftp_ratio":  0.8,
                       "notes":  ""
                   },
                   {
                       "start":  1080,
                       "ftp_ratio":  0.95,
                       "notes":  ""
                   },
                   {
                       "start":  1140,
                       "ftp_ratio":  0.55,
                       "notes":  ""
                   },
                   {
                       "start":  1200,
                       "ftp_ratio":  0.8,
                       "notes":  ""
                   },
                   {
                       "start":  1380,
                       "ftp_ratio":  0.95,
                       "notes":  ""
                   },
                   {
                       "start":  1440,
                       "ftp_ratio":  0.55,
                       "notes":  ""
                   },
                   {
                       "start":  1500,
                       "ftp_ratio":  0.8,
                       "notes":  ""
                   },
                   {
                       "start":  1680,
                       "ftp_ratio":  0.95,
                       "notes":  ""
                   },
                   {
                       "start":  1740,
                       "ftp_ratio":  0.55,
                       "notes":  ""
                   },
                   {
                       "start":  1800,
                       "ftp_ratio":  0.8,
                       "notes":  ""
                   },
                   {
                       "start":  1980,
                       "ftp_ratio":  0.95,
                       "notes":  ""
                   },
                   {
                       "start":  2040,
                       "ftp_ratio":  0.55,
                       "notes":  ""
                   },
                   {
                       "start":  2100,
                       "ftp_ratio":  0.8,
                       "notes":  ""
                   },
                   {
                       "start":  2280,
                       "ftp_ratio":  0.95,
                       "notes":  ""
                   },
                   {
                       "start":  2340,
                       "ftp_ratio":  0.55,
                       "notes":  ""
                   },
                   {
                       "start":  2400,
                       "ftp_ratio":  0.8,
                       "notes":  ""
                   },
                   {
                       "start":  2580,
                       "ftp_ratio":  0.95,
                       "notes":  ""
                   },
                   {
                       "start":  2640,
                       "ftp_ratio":  0.55,
                       "notes":  ""
                   },
                   {
                       "start":  2700,
                       "ftp_ratio":  0.8,
                       "notes":  ""
                   },
                   {
                       "start":  2880,
                       "ftp_ratio":  0.95,
                       "notes":  ""
                   },
                   {
                       "start":  2910,
                       "ftp_ratio":  1.075,
                       "notes":  ""
                   },
                   {
                       "start":  2940,
                       "ftp_ratio":  0.55,
                       "notes":  ""
                   },
                   {
                       "start":  3000,
                       "ftp_ratio":  0.6,
                       "notes":  ""
                   },
                   {
                       "start":  3300,
                       "ftp_ratio":  0.5,
                       "notes":  ""
                   },
                   {
                       "start":  3600,
                       "ftp_ratio":  0.5,
                       "notes":  ""
                   }
               ],
    "creation_date":  "2026-06-25T00:00:00+02:00",
    "source":  "Converted from Sneaky__1_.zwo"
}
