{
    "id": "flash_burn",
    "training_name": "Flash Burn",
    "description": "Flash Burn 16min",
    "duration":960,
    "units": {
      "time": "seconds",
      "ftp_ratio": "number"
    },
    "phases": [
      {
        "start": 0,
        "ftp_ratio": 0.5,
        "notes": ""
      },
      {
        "start": 30,
        "ftp_ratio": 0.6,
        "notes": ""
      },
      {
        "start": 60,
        "ftp_ratio": 0.7,
        "notes": ""
      },
      {
        "start": 90,
        "ftp_ratio": 0.8,
        "notes": ""
      },
      {
        "start": 120,
        "ftp_ratio": 0.85,
        "notes": ""
      },
      {
        "start": 160,
        "ftp_ratio": 0.7,
        "notes": ""
      },
      {
        "start": 180,
        "ftp_ratio": 0.85,
        "notes": ""
      },
      {
        "start": 220,
        "ftp_ratio": 0.7,
        "notes": ""
      },
      {
        "start": 240,
        "ftp_ratio": 0.85,
        "notes": ""
      },
      {
        "start": 280,
        "ftp_ratio": 0.7,
        "notes": ""
      },
      {
        "start": 300,
        "ftp_ratio": 0.85,
        "notes": ""
      },
      {
        "start": 360,
        "ftp_ratio": 0.9,
        "notes": ""
      },
      {
        "start": 390,
        "ftp_ratio": 0.7,
        "notes": ""
      },
      {
        "start": 420,
        "ftp_ratio": 0.9,
        "notes": ""
      },
      {
        "start": 450,
        "ftp_ratio": 0.7,
        "notes": ""
      },
      {
        "start": 480,
        "ftp_ratio": 0.9,
        "notes": ""
      },
      {
        "start": 510,
        "ftp_ratio": 0.7,
        "notes": ""
      },
      {
        "start": 540,
        "ftp_ratio": 0.8,
        "notes": ""
      },
      {
        "start": 600,
        "ftp_ratio": 1,
        "notes": ""
      },
      {
        "start": 620,
        "ftp_ratio": 0.7,
        "notes": ""
      },
      {
        "start": 660,
        "ftp_ratio": 1,
        "notes": ""
      },
      {
        "start": 680,
        "ftp_ratio": 0.7,
        "notes": ""
      },
      {
        "start": 720,
        "ftp_ratio": 1,
        "notes": ""
      },
      {
        "start": 740,
        "ftp_ratio": 0.7,
        "notes": ""
      },
      {
        "start": 780,
        "ftp_ratio": 1.2,
        "notes": ""
      },
      {
        "start": 790,
        "ftp_ratio": 0.7,
        "notes": ""
      },
      {
        "start": 840,
        "ftp_ratio": 1.2,
        "notes": ""
      },
      {
        "start": 850,
        "ftp_ratio": 0.7,
        "notes": ""
      },
      {
        "start": 900,
        "ftp_ratio": 1.2,
        "notes": ""
      },
      {
        "start": 910,
        "ftp_ratio": 0.7,
        "notes": ""
      },
      {
        "start": 960,
        "ftp_ratio": 0.6,
        "notes": ""
      }
    ],
    "creation_date": "2025-05-25T11:37:24+02:00",
    "source": "User Input"
  }
