{
    "id": "training1",
    "training_name": "First training",
    "description": "Relax session 25min",
    "duration": 1500,
    "units": {
      "time": "seconds",
      "ftp_ratio": "number"
    },
    "phases": [
      {
        "start": 0,
        "ftp_ratio": 0.4,
        "notes": "Description or annotation specific to this phase (optional)."
      },
      {
        "start": 30,
        "ftp_ratio": 0.5,
        "notes": "Another note for phase 2."
      },
      {
        "start": 60,
        "ftp_ratio": 0.6,
        "notes": null
      },
      {
        "start": 300,
        "ftp_ratio": 0.75,
        "notes": ""
      },
      {
        "start": 1200,
        "ftp_ratio": 0.6,
        "notes": ""
      },
      {
        "start": 1500,
        "ftp_ratio": 0.4,
        "notes": "End of the sequence."
      }
    ],
    "creation_date": "2024-10-27T10:00:00Z",
    "source": "Name or description of the data source (optional)."
  }
