{
  "id": "over_under_engine_48",
  "training_name": "Over Under Engine",
  "description": "Threshold over-under 48min",
  "duration":2880,
  "units": {
    "time": "seconds",
    "ftp_ratio": "number"
  },
  "phases": [
    {
      "start": 0,
      "ftp_ratio": 0.5,
      "notes": ""
    },
    {
      "start": 300,
      "ftp_ratio": 0.65,
      "notes": ""
    },
    {
      "start": 600,
      "ftp_ratio": 0.95,
      "notes": ""
    },
    {
      "start": 720,
      "ftp_ratio": 1.05,
      "notes": ""
    },
    {
      "start": 840,
      "ftp_ratio": 0.95,
      "notes": ""
    },
    {
      "start": 960,
      "ftp_ratio": 1.05,
      "notes": ""
    },
    {
      "start": 1080,
      "ftp_ratio": 0.6,
      "notes": ""
    },
    {
      "start": 1260,
      "ftp_ratio": 0.95,
      "notes": ""
    },
    {
      "start": 1380,
      "ftp_ratio": 1.05,
      "notes": ""
    },
    {
      "start": 1500,
      "ftp_ratio": 0.95,
      "notes": ""
    },
    {
      "start": 1620,
      "ftp_ratio": 1.05,
      "notes": ""
    },
    {
      "start": 1740,
      "ftp_ratio": 0.6,
      "notes": ""
    },
    {
      "start": 1920,
      "ftp_ratio": 0.95,
      "notes": ""
    },
    {
      "start": 2040,
      "ftp_ratio": 1.05,
      "notes": ""
    },
    {
      "start": 2160,
      "ftp_ratio": 0.95,
      "notes": ""
    },
    {
      "start": 2280,
      "ftp_ratio": 1.05,
      "notes": ""
    },
    {
      "start": 2400,
      "ftp_ratio": 0.6,
      "notes": ""
    },
    {
      "start": 2700,
      "ftp_ratio": 0.5,
      "notes": ""
    },
    {
      "start": 2880,
      "ftp_ratio": 0.5,
      "notes": ""
    }
  ],
  "creation_date": "2026-05-14T21:45:00+02:00",
  "source": "BullWatt Catalog Expansion"
}
