{
    "id":  "ftp_ramp_test_43min",
    "training_name":  "FTP Ramp Test 43min",
    "description":  "Converted from FTP_Ramp_Test__1_ 43min",
    "duration": 2580,
    "units":  {
                  "time":  "seconds",
                  "ftp_ratio":  "number"
              },
    "phases":  [
                   {
                       "start":  0,
                       "ftp_ratio":  0.5,
                       "notes":  ""
                   },
                   {
                       "start":  300,
                       "ftp_ratio":  1,
                       "notes":  ""
                   },
                   {
                       "start":  360,
                       "ftp_ratio":  1.2,
                       "notes":  ""
                   },
                   {
                       "start":  420,
                       "ftp_ratio":  1.4,
                       "notes":  ""
                   },
                   {
                       "start":  480,
                       "ftp_ratio":  1.6,
                       "notes":  ""
                   },
                   {
                       "start":  540,
                       "ftp_ratio":  1.8,
                       "notes":  ""
                   },
                   {
                       "start":  600,
                       "ftp_ratio":  2,
                       "notes":  ""
                   },
                   {
                       "start":  660,
                       "ftp_ratio":  2.2,
                       "notes":  ""
                   },
                   {
                       "start":  720,
                       "ftp_ratio":  2.4,
                       "notes":  ""
                   },
                   {
                       "start":  780,
                       "ftp_ratio":  2.6,
                       "notes":  ""
                   },
                   {
                       "start":  840,
                       "ftp_ratio":  2.8,
                       "notes":  ""
                   },
                   {
                       "start":  900,
                       "ftp_ratio":  3,
                       "notes":  ""
                   },
                   {
                       "start":  960,
                       "ftp_ratio":  3.2,
                       "notes":  ""
                   },
                   {
                       "start":  1020,
                       "ftp_ratio":  3.4,
                       "notes":  ""
                   },
                   {
                       "start":  1080,
                       "ftp_ratio":  3.6,
                       "notes":  ""
                   },
                   {
                       "start":  1140,
                       "ftp_ratio":  3.8,
                       "notes":  ""
                   },
                   {
                       "start":  1200,
                       "ftp_ratio":  4,
                       "notes":  ""
                   },
                   {
                       "start":  1260,
                       "ftp_ratio":  4.2005,
                       "notes":  ""
                   },
                   {
                       "start":  1320,
                       "ftp_ratio":  4.4,
                       "notes":  ""
                   },
                   {
                       "start":  1380,
                       "ftp_ratio":  4.6,
                       "notes":  ""
                   },
                   {
                       "start":  1440,
                       "ftp_ratio":  4.8,
                       "notes":  ""
                   },
                   {
                       "start":  1500,
                       "ftp_ratio":  5,
                       "notes":  ""
                   },
                   {
                       "start":  1560,
                       "ftp_ratio":  5.2,
                       "notes":  ""
                   },
                   {
                       "start":  1620,
                       "ftp_ratio":  5.4,
                       "notes":  ""
                   },
                   {
                       "start":  1680,
                       "ftp_ratio":  5.6,
                       "notes":  ""
                   },
                   {
                       "start":  1740,
                       "ftp_ratio":  5.8,
                       "notes":  ""
                   },
                   {
                       "start":  1800,
                       "ftp_ratio":  6,
                       "notes":  ""
                   },
                   {
                       "start":  1860,
                       "ftp_ratio":  6.2,
                       "notes":  ""
                   },
                   {
                       "start":  1920,
                       "ftp_ratio":  6.4,
                       "notes":  ""
                   },
                   {
                       "start":  1980,
                       "ftp_ratio":  0.725,
                       "notes":  ""
                   },
                   {
                       "start":  2580,
                       "ftp_ratio":  0.725,
                       "notes":  ""
                   }
               ],
    "creation_date":  "2026-06-25T00:00:00+02:00",
    "source":  "Converted from FTP_Ramp_Test__1_.zwo"
}
