    {
  "id": "solid50min",
  "training_name": "Solid 50min",
  "description": "Solid endurance training 50min",
  "duration":3000,
  "units": {
    "time": "seconds",
    "ftp_ratio": "number"
  },
  "phases": [
    {
      "start": 0,
      "ftp_ratio": 0.5,
      "notes": ""
    },
    {
      "start": 180,
      "ftp_ratio": 0.7,
      "notes": ""
    },
    {
      "start": 210,
      "ftp_ratio": 0.6,
      "notes": ""
    },
    {
      "start": 300,
      "ftp_ratio": 0.9,
      "notes": ""
    },
    {
      "start": 330,
      "ftp_ratio": 0.6,
      "notes": ""
    },
    {
      "start": 480,
      "ftp_ratio": 0.8,
      "notes": ""
    },
    {
      "start": 1080,
      "ftp_ratio": 0.6,
      "notes": ""
    },
    {
      "start": 1320,
      "ftp_ratio": 0.8,
      "notes": ""
    },
    {
      "start": 1920,
      "ftp_ratio": 0.6,
      "notes": ""
    },
    {
      "start": 2220,
      "ftp_ratio": 0.8,
      "notes": ""
    },
    {
      "start": 2820,
      "ftp_ratio": 0.6,
      "notes": ""
    },
    {
      "start": 3000,
      "ftp_ratio": 0.5,
      "notes": ""
    }
  ],
  "creation_date": "2025-09-17T20:40:10+02:00",
  "source": "User Input"
}
