{
    "id":  "lox_60min",
    "training_name":  "LOX 60min",
    "description":  "Converted from LOX__1_ 60min",
    "duration": 3600,
    "units":  {
                  "time":  "seconds",
                  "ftp_ratio":  "number"
              },
    "phases":  [
                   {
                       "start":  0,
                       "ftp_ratio":  0.5,
                       "notes":  ""
                   },
                   {
                       "start":  600,
                       "ftp_ratio":  0.95,
                       "notes":  ""
                   },
                   {
                       "start":  630,
                       "ftp_ratio":  0.5,
                       "notes":  ""
                   },
                   {
                       "start":  660,
                       "ftp_ratio":  1.05,
                       "notes":  ""
                   },
                   {
                       "start":  690,
                       "ftp_ratio":  0.5,
                       "notes":  ""
                   },
                   {
                       "start":  720,
                       "ftp_ratio":  1.15,
                       "notes":  ""
                   },
                   {
                       "start":  750,
                       "ftp_ratio":  0.5,
                       "notes":  ""
                   },
                   {
                       "start":  780,
                       "ftp_ratio":  0.5,
                       "notes":  ""
                   },
                   {
                       "start":  900,
                       "ftp_ratio":  1.15,
                       "notes":  ""
                   },
                   {
                       "start":  1080,
                       "ftp_ratio":  0.55,
                       "notes":  ""
                   },
                   {
                       "start":  1260,
                       "ftp_ratio":  1.15,
                       "notes":  ""
                   },
                   {
                       "start":  1440,
                       "ftp_ratio":  0.55,
                       "notes":  ""
                   },
                   {
                       "start":  1620,
                       "ftp_ratio":  1.15,
                       "notes":  ""
                   },
                   {
                       "start":  1800,
                       "ftp_ratio":  0.55,
                       "notes":  ""
                   },
                   {
                       "start":  1980,
                       "ftp_ratio":  1.15,
                       "notes":  ""
                   },
                   {
                       "start":  2160,
                       "ftp_ratio":  0.55,
                       "notes":  ""
                   },
                   {
                       "start":  2340,
                       "ftp_ratio":  1.15,
                       "notes":  ""
                   },
                   {
                       "start":  2520,
                       "ftp_ratio":  0.55,
                       "notes":  ""
                   },
                   {
                       "start":  2700,
                       "ftp_ratio":  0.9,
                       "notes":  ""
                   },
                   {
                       "start":  3300,
                       "ftp_ratio":  0.575,
                       "notes":  ""
                   },
                   {
                       "start":  3600,
                       "ftp_ratio":  0.575,
                       "notes":  ""
                   }
               ],
    "creation_date":  "2026-06-25T00:00:00+02:00",
    "source":  "Converted from LOX__1_.zwo"
}
